{
  "meta": {
    "name": "Grounded Agency Capability Ontology",
    "version": "2.0.0",
    "generated_at": "2026-01-26T00:00:00.000Z",
    "description": "36 atomic capabilities derived from first principles",
    "principles": [
      "Capabilities are atomic and composable into workflows",
      "Every capability returns evidence anchors and confidence",
      "High-risk capabilities require checkpoint + verification",
      "Capabilities are organized into 9 cognitive layers"
    ],
    "derivation": {
      "method": "First-principles analysis",
      "sources": [
        "BDI cognitive architecture",
        "ReAct agent pattern",
        "Claude Skills architecture",
        "MCP tool patterns"
      ],
      "documentation": "docs/methodology/FIRST_PRINCIPLES_REASSESSMENT.md"
    }
  },
  "layers": {
    "PERCEIVE": {
      "description": "Information acquisition from the world",
      "cognitive_mapping": "BDI: Belief acquisition",
      "capabilities": ["retrieve", "search", "observe", "receive"]
    },
    "UNDERSTAND": {
      "description": "Making sense of information",
      "cognitive_mapping": "BDI: Belief formation",
      "capabilities": ["detect", "classify", "measure", "predict", "compare", "discover"]
    },
    "REASON": {
      "description": "Planning and analysis",
      "cognitive_mapping": "BDI: Deliberation",
      "capabilities": ["plan", "decompose", "critique", "explain"]
    },
    "MODEL": {
      "description": "World representation",
      "cognitive_mapping": "BDI: World model",
      "capabilities": ["state", "transition", "attribute", "ground", "simulate"]
    },
    "SYNTHESIZE": {
      "description": "Content creation",
      "cognitive_mapping": "Action planning",
      "capabilities": ["generate", "transform", "integrate"]
    },
    "EXECUTE": {
      "description": "Changing the world",
      "cognitive_mapping": "BDI: Intention execution",
      "capabilities": ["execute", "mutate", "send"]
    },
    "VERIFY": {
      "description": "Correctness assurance",
      "cognitive_mapping": "Control theory",
      "capabilities": ["verify", "checkpoint", "rollback", "constrain", "audit"]
    },
    "REMEMBER": {
      "description": "State persistence",
      "cognitive_mapping": "Cognitive: Long-term memory",
      "capabilities": ["persist", "recall"]
    },
    "COORDINATE": {
      "description": "Multi-agent and user interaction",
      "cognitive_mapping": "Multi-agent systems",
      "capabilities": ["delegate", "synchronize", "invoke", "inquire"]
    }
  },
  "nodes": [
    {
      "id": "retrieve",
      "layer": "PERCEIVE",
      "description": "Get specific data by reference (ID, path, URI)",
      "risk": "low",
      "mutation": false,
      "input_schema": {
        "type": "object",
        "required": ["target"],
        "properties": {
          "target": {"type": "string", "description": "Reference to data (ID, path, URI)"},
          "format": {"type": "string", "description": "Expected format of retrieved data"}
        }
      },
      "output_schema": {
        "type": "object",
        "required": ["data", "evidence_anchors", "confidence"],
        "properties": {
          "data": {"type": "any", "description": "Retrieved data"},
          "evidence_anchors": {"type": "array", "description": "Source references"},
          "confidence": {"type": "number", "minimum": 0, "maximum": 1}
        }
      }
    },
    {
      "id": "search",
      "layer": "PERCEIVE",
      "description": "Query for data matching criteria",
      "risk": "low",
      "mutation": false,
      "input_schema": {
        "type": "object",
        "required": ["query"],
        "properties": {
          "query": {"type": "string|object", "description": "Search criteria"},
          "scope": {"type": "string", "description": "Search scope/domain"},
          "limit": {"type": "integer", "description": "Maximum results"}
        }
      },
      "output_schema": {
        "type": "object",
        "required": ["results", "evidence_anchors", "confidence"],
        "properties": {
          "results": {"type": "array", "description": "Matching items"},
          "total_count": {"type": "integer"},
          "evidence_anchors": {"type": "array"},
          "confidence": {"type": "number", "minimum": 0, "maximum": 1}
        }
      }
    },
    {
      "id": "observe",
      "layer": "PERCEIVE",
      "description": "Watch and report current state",
      "risk": "low",
      "mutation": false,
      "input_schema": {
        "type": "object",
        "required": ["target"],
        "properties": {
          "target": {"type": "string", "description": "What to observe"},
          "aspects": {"type": "array", "description": "Specific aspects to observe"}
        }
      },
      "output_schema": {
        "type": "object",
        "required": ["observation", "evidence_anchors", "confidence"],
        "properties": {
          "observation": {"type": "object", "description": "Current state"},
          "timestamp": {"type": "string", "format": "date-time"},
          "evidence_anchors": {"type": "array"},
          "confidence": {"type": "number", "minimum": 0, "maximum": 1}
        }
      }
    },
    {
      "id": "receive",
      "layer": "PERCEIVE",
      "description": "Accept pushed data or events",
      "risk": "low",
      "mutation": false,
      "input_schema": {
        "type": "object",
        "properties": {
          "channel": {"type": "string", "description": "Source channel"},
          "filter": {"type": "object", "description": "Event filter criteria"},
          "timeout": {"type": "string", "description": "Wait timeout"}
        }
      },
      "output_schema": {
        "type": "object",
        "required": ["data", "evidence_anchors"],
        "properties": {
          "data": {"type": "array", "items": {"type": "object"}, "description": "Received data/events"},
          "source": {"type": "string", "description": "Event source"},
          "timestamp": {"type": "string", "format": "date-time"},
          "evidence_anchors": {"type": "array"}
        }
      }
    },
    {
      "id": "detect",
      "layer": "UNDERSTAND",
      "description": "Find patterns or occurrences in data",
      "risk": "low",
      "mutation": false,
      "input_schema": {
        "type": "object",
        "required": ["data", "pattern"],
        "properties": {
          "data": {"type": "any", "description": "Data to analyze"},
          "pattern": {"type": "string|object", "description": "Pattern to find"},
          "threshold": {"type": "number", "description": "Detection threshold"}
        }
      },
      "output_schema": {
        "type": "object",
        "required": ["detected", "evidence_anchors", "confidence"],
        "properties": {
          "detected": {"type": "boolean"},
          "matches": {"type": "array", "description": "Found occurrences"},
          "locations": {"type": "array", "description": "Where patterns found"},
          "evidence_anchors": {"type": "array"},
          "confidence": {"type": "number", "minimum": 0, "maximum": 1}
        }
      }
    },
    {
      "id": "classify",
      "layer": "UNDERSTAND",
      "description": "Assign labels or categories to items",
      "risk": "low",
      "mutation": false,
      "input_schema": {
        "type": "object",
        "required": ["item"],
        "properties": {
          "item": {"type": "any", "description": "Item to classify"},
          "taxonomy": {"type": "string|array", "description": "Classification scheme"},
          "multi_label": {"type": "boolean", "description": "Allow multiple labels"}
        }
      },
      "output_schema": {
        "type": "object",
        "required": ["labels", "evidence_anchors", "confidence"],
        "properties": {
          "labels": {"type": "array", "description": "Assigned labels"},
          "probabilities": {"type": "object", "description": "Label probabilities"},
          "evidence_anchors": {"type": "array"},
          "confidence": {"type": "number", "minimum": 0, "maximum": 1}
        }
      }
    },
    {
      "id": "measure",
      "layer": "UNDERSTAND",
      "description": "Quantify values with uncertainty",
      "risk": "low",
      "mutation": false,
      "input_schema": {
        "type": "object",
        "required": ["target", "metric"],
        "properties": {
          "target": {"type": "any", "description": "What to measure"},
          "metric": {"type": "string", "description": "Measurement type"},
          "unit": {"type": "string", "description": "Unit of measurement"}
        }
      },
      "output_schema": {
        "type": "object",
        "required": ["value", "uncertainty", "evidence_anchors", "confidence"],
        "properties": {
          "value": {"type": "number"},
          "uncertainty": {"type": "object", "properties": {"lower": {"type": "number"}, "upper": {"type": "number"}}},
          "unit": {"type": "string"},
          "evidence_anchors": {"type": "array"},
          "confidence": {"type": "number", "minimum": 0, "maximum": 1}
        }
      }
    },
    {
      "id": "predict",
      "layer": "UNDERSTAND",
      "description": "Forecast future states or outcomes",
      "risk": "low",
      "mutation": false,
      "input_schema": {
        "type": "object",
        "required": ["target"],
        "properties": {
          "target": {"type": "string", "description": "What to predict"},
          "horizon": {"type": "string", "description": "Prediction timeframe"},
          "conditions": {"type": "object", "description": "Assumed conditions"}
        }
      },
      "output_schema": {
        "type": "object",
        "required": ["prediction", "probability", "evidence_anchors", "confidence"],
        "properties": {
          "prediction": {"type": "any", "description": "Predicted outcome"},
          "probability": {"type": "number", "minimum": 0, "maximum": 1},